question_id|difficulty|question_text
201144|0.8499748203085656|曹曹曹曹曹曹曹曹 안에 알맞은 수를 써넣으세요. (1) 삼 &#10140;  (2) 오 &#10140; 
201145|0.8044630748366416|토끼 다리의 수를 바르게 센 것은 어느 것인가요? 
201146|0.8754260477173443|그림의 수가 1인 것을 찾아 기호를 쓰세요.  
201147|0.8531062961072704|수를 세어 이어 보세요.  4 셋 1 하나 3 넷   
201148|0.7728908603950452|그림의 수와 관계있는 것을 모두 찾아 기호를 쓰세요.   , 
201154|0.976086292866592|꽃의 수를 세어 曹曹曹曹曹曹曹曹 안에 알맞은 수를 써넣으세요.  &#10140;  
201155|0.9305885708852334|그림을 보고 曹曹曹曹曹曹曹曹 안에 알맞은 수를 써넣으세요.  (1) 어린이는 명입니다.  (2) 의자는 개입니다. 
201156|0.9538613861386138|★의 수가 3인 것을 찾아 기호를 쓰세요.  
201157|0.7952724988220512|우유의 수를 세어 쓰고 두 가지 방법으로 읽어 보세요.   쓰기: 읽기: , 
201158|0.8549201357278822|수를 잘못 읽은 것을 찾아 기호를 쓰세요.  
202025|0.8929496604354827| 안에 알맞은 말을 고르세요.     딸기는 사과보다  .
202026|0.8345546218487395|더 큰 수를 찾아 써 보세요.  (1) &#10140;  (2) &#10140; 
202027|0.9383039359161981|다음 수 중에서 5보다 작은 수를 찾아 써 보세요.    
202028|0.8285191212367778|종이학을 연서는 7마리, 수지는 5마리 접었습니다. 종이학을 더 많이 접은 어린이는 누구인가요?  
202029|0.8910855239336665|가장 큰 수와 가장 작은 수를 각각 써 보세요.   가장 큰 수: 가장 작은 수: 
202035|0.7648900095643857| 틀린 것을 찾아 기호를 쓰세요.   
202036|0.9207646488433301|6보다 큰 수가 쓰여 있는 수 카드를 모두 찾아 써 보세요.           , 
202037|0.8926759464030181|큰 수부터 차례로 써 보세요.   , , 
202038|0.8832527127729115|강아지가 7마리, 고양이가 6마리, 햄스터가 8마리 있습니다. 가장 많은 동물은 어느 것인가요?  
202039|0.6639323467230444|3보다 크고 7보다 작은 수는 모두 몇 개인가요?  개
200988|0.9205378973105135| 모양을 모두 찾아 기호를 쓰세요.   , 
200989|0.9663545710588415|모양이 같은 것끼리 이어 보세요.        
200990|0.9184664087231798|다음 물건과 같은 모양의 물건은 어느 것인가요?    
200991|0.9221631076452154| 모양을 찾아 쓰세요.  
200992|0.8385581926640436|다음에서 가장 많은 모양을 찾아 기호를 쓰세요.   ㉠ ㉡ ㉢  
201016|0.9892037786774629| 모양은 어느 것인가요?
201017|0.9125412541254125|왼쪽과 같은 모양을 찾아 기호를 쓰세요.  ㉠ ㉡ ㉢ ㉠ ㉡ ㉢ ㉠ ㉡ ㉢  
201018|0.972830561501729|모양이 나머지 셋과 다른 것은 어느 것인가요?  
201019|0.9549259497746297|모양이 같은 것끼리 모은 것입니다. 잘못 모은 것은 어느 것인가요? 
201020|0.8475181998676373|두 사람이 가지고 있는 물건 중에서 똑같이 찾을 수 있는 모양을 찾아 기호를 쓰세요.     지우현수 ㉠ ㉡ ㉢ 
201026|0.9563269876819709|어떤 모양의 일부분입니다. 어떤 모양인지 찾아 기호를 쓰세요.   ㉠㉡ ㉢  
201027|0.9680745436492783|어떤 모양의 일부분입니다. 관계있는 물건을 찾아 기호를 쓰세요.  ㉠㉡ ㉢  
201028|0.8354090354090354|다음 모양들의 특징을 찾아 기호를 쓰세요.     
201029|0.7278642695329445|승호와 진아가 다음과 같은 필통의 모양에 대해 설명한 것입니다. 설명을 잘못한 사람은 누구인가요?  승호: 평평한 부분이 있어.진아: 눕혀서 굴리면 잘 굴러가.  
201030|0.8082554986441699|쌓을 수 있는 물건은 모두 몇 개일까요?    개
201036|0.9414948076641801|어떤 모양의 일부분입니다. 어떤 모양인지 찾아 기호를 쓰세요.  ㉠㉡ ㉢  
201037|0.952324017336721|다음을 읽고 해당하는 모양을 찾아 이어 보세요.     
201038|0.9521205851928476|모든 방향으로 잘 굴러가는 물건은 어느 것인가요?     
201039|0.9550022498875056|어떤 모양의 일부분입니다. 같은 모양의 물건은 모두 몇 개인가요?      개
201040|0.7417182870993806|소희는 물건을 다음과 같이 나누었습니다. 나눈 기준을 찾아 기호를 쓰세요.    
201046|0.9192198475564191|다음과 같은 모양을 만드는 데 이용한 모양을 찾아 기호를 쓰세요.    
201047|0.8969401846064394|다음과 같은 모양을 만드는 데 이용한 모양을 모두 찾아 기호를 쓰세요.    , 
201048|0.8252261701848695|다음과 같은 모양을 만드는 데 이용하지 않은 모양을 찾아 기호를 쓰세요.    
201049|0.8641975308641975|다음과 같은 모양을 만드는 데 이용한  모양의 개수를 구하세요.  개
201050|0.7479867622724765|다음과 같은 모양을 만드는 데 이용한 모양의 개수를 세어 曹曹曹曹曹曹曹曹 안에 알맞은 수를 각각 써넣으세요.   모양: 개 모양: 개 모양: 개
201056|0.96900752418488|다음과 같은 모양을 만드는 데 이용한 모양을 찾아 기호를 쓰세요.    
201057|0.7811147540983606|가와 나에 모두 이용한 모양을 찾아 기호를 쓰세요. 가 나  
201058|0.8568524970963995|, ,  모양을 모두 이용하여 만든 모양이 아닌 것을 찾아 기호를 쓰세요.  
201059|0.7439782016348774|다음과 같은 모양을 만드는 데 이용한 모양의 개수를 세어 曹曹曹曹曹曹曹曹 안에 알맞은 수를 각각 써넣으세요.    모양: 개 모양: 개 모양: 개 
201060|0.9632468211113047|주어진 모양을 모두 이용하여 만든 것을 찾아 이어 보세요.     
204710|0.9317401637179825|그림을 보고 모으기를 해 보세요.  
204711|0.9376874375208264|그림을 보고 가르기를 해 보세요  
204712|0.9248721646781172|☆을 모으기 하려고 합니다. 빈 곳에 그려야 하는 ☆은 모두 몇 개인가요?  개
204713|0.8962054280811034|두 주사위의 눈의 수를 모으기 하여 3이 되는 것을 찾아 기호를 쓰세요.       
204714|0.8249361891022085|그림을 보고 장미 9송이를 가르기 하려고 합니다. 曹曹曹曹曹曹曹曹 안에 알맞은 수를 써넣으세요.        송이와 송이
204720|0.8600655589465356|♡를 가르기 하려고 합니다. 빈 곳에 그려야 하는 ♡는 몇 개인가요?   개
204721|0.9525090811247141|그림을 보고 빈칸에 알맞은 수를 써넣으세요.          
204722|0.9232936355487258|가르기를 해 보세요.     
204723|0.9084884017333673|공깃돌을 모으기 하면 6개가 되는 것끼리 이어 보세요.      
204724|0.8955750060782883|두 주사위의 눈의 수를 모으기 하여 7이 되는 것을 찾아 기호를 쓰세요.  
204730|0.954416826003824|빈칸에 알맞은 수를 써넣으세요.  (1)(2)
204731|0.8751427228155014|수를 가르기 한 것을 찾아 이어 보세요.   ,       ,       , 
204732|0.7581847649918962|9를 두 수로 가르기 한 것입니다. 잘못 가르기 한 것을 찾아 기호를 쓰세요.    
204733|0.8137164040778498|빈 곳에 알맞은 수를 써넣으세요.  
204734|0.6646721271273726|위와 아래의 두 수를 모으기 하여 7이 되도록 만들어 보세요.  152763
204740|0.954019130726632|모으기 해 보세요. 
204741|0.9187648456057007|두 수를 모으기 해서 7이 되지 않는 것은 어느 것인가요?
204742|0.7830588235294118|수를 가르기 한 것입니다. ㉠, ㉡, ㉢ 중 다른 하나를 찾아 기호를 쓰세요.                  
204743|0.6763320712900545|똑같은 두 수로 가르기 할 수 있는 수를 모두 찾아 쓰세요.   , 
204744|0.6647738209817132|㉠에 알맞은 수를 구하세요.  
204750|0.745618693574084|그림을 보고 曹曹曹曹曹曹曹曹 안에 알맞은 수를 써넣으세요.  지욱이가 어제까지 받은 붙임 딱지는 개입니다.오늘 개를 더 받아서 붙임 딱지는 모두 개가 되었습니다.
204751|0.8928191893122818|그림을 보고 曹曹曹曹曹曹曹曹 안에 알맞은 수를 써넣으세요. 미끄럼틀을 타는 어린이는 2명,그네를 타는 어린이는 명이므로놀이터에 있는 어린이는 모두 명입니다.
204752|0.8891511229539398|그림을 보고 曹曹曹曹曹曹曹曹 안에 알맞은 수를 써넣으세요.  물 웅덩이에 개구리 7마리가 있었는데마리가 밖으로 나와서물 속에는 개구리가 모두 마리 남았습니다.
204753|0.7308113368203382|그림을 보고 曹曹曹曹曹曹曹曹 안에 알맞은 수를 써넣으세요. 주원재은주원이가 던진 주사위의 눈은 개이고,재은이가 던진 주사위의 눈은 개이므로주원이가 던진 주사위의 눈이 개 더 많습니다.
204758|0.814529280948851|그림을 보고 曹曹曹曹曹曹曹曹 안에 알맞은 수를 써넣으세요.  소라네 가족은 어른이 명,어린이가 2명이므로 모두 명입니다.
204759|0.8898989898989899|그림을 보고 曹曹曹曹曹曹曹曹 안에 알맞은 수를 써넣으세요. 수혁이의 앨범에는 사진 장이 붙어 있습니다. 가지고 있는 사진 장을 더 붙이면 수혁이 앨범의 사진은 모두 장이 됩니다.
204760|0.8251239157372986|그림을 보고 曹曹曹曹曹曹曹曹 안에 알맞은 수를 써넣으세요.  범퍼카를 타기 위해 줄을 서 있던 어린이 명 중에서명이 범퍼카를 타러 들어가서 명이 남았습니다.
204761|0.763608731693838|그림을 보고 曹曹曹曹曹曹曹曹 안에 알맞은 수를 써넣으세요. 돼지가 우리 밖에는 마리 있고, 우리 안에는 마리 있으므로 우리 밖에 있는 돼지가 마리 더 많습니다.
204766|0.9653615630108197|다음을 덧셈식으로 나타내려고 합니다. 曹曹曹曹曹曹曹曹 안에 + 또는 =를 알맞게 써넣으세요.  156   
204767|0.8670804938937994|그림에 알맞은 덧셈식을 쓰고 읽어 보세요. 3+= 3 더하기 는 와 같습니다.
204768|0.8789641323916355|그림에 알맞은 덧셈식을 쓰고 읽어 보세요.   5+= 5와 의 합은 입니다. 
204769|0.897011395398839|다음을 읽고 화단에 핀 꽃은 모두 몇 송이인지 덧셈식으로 나타내어 보세요.     5+= 
204770|0.6249610539902969|그림을 보고 잘못 설명한 것을 찾아 기호를 쓰세요.       
204776|0.9462700513938639|다음을 덧셈식으로 나타내어 보세요.   +4=   
204777|0.6848644946678407|그림에 알맞은 덧셈식을 쓰고 읽어 보세요. (1) 4+2= (2) 4  2는 과 같습니다.  (3) 4와 2의 은 입니다. 
204778|0.8766005346841143|다음을 읽고 달걀이 모두 몇 개인지 덧셈식으로 나타내어 보세요.        2+=
204779|0.6340009315323708|그림을 보고 잘못 설명한 것을 모두 고르세요.   
204780|0.8583176058236721|덧셈식으로 잘못 나타낸 사람은 누구인가요?  정은준수시아2+6=88+1=94+3=6 
204786|0.9198850494147333|그림을 보고 덧셈식을 써 보세요.  ●●   ●●●●   2+=   
204787|0.7920133111480865|그림을 보고 덧셈식을 써 보세요.   ●●●●●●●●     += 
204788|0.8504638218923933|&#9711;를 그려 덧셈을 한 것입니다. 틀린 것을 찾아 기호를 쓰세요.  
204789|0.7695056908780997|그림을 보고 알맞은 덧셈식을 모두 찾아 기호를 쓰세요. ●●●●●●●●    ,    
204790|0.6524754294112244|그림을 보고 색종이는 몇 장인지 덧셈식을 써 보세요.     5+=, 3+=
204796|0.9386474908200735|그림을 보고 덧셈식을 써 보세요.    ●●●●●●●   3+=   
204797|0.7950145208131656|다음을 읽고 &#9711;를 바르게 그린 것을 찾아 기호를 쓰고, 과일은 모두 몇 개인지 덧셈식을 써 보세요.      , 5+= 
204798|0.7134300126103404|그림에 알맞은 덧셈식을 모두 고르세요. ●●●●●●●●● 
204799|0.8937887303646058|알맞은 것끼리 이어 보세요. 2+4=65+2=72+6=8   ●●●●●●●   ●●●●●●●●  ●●●●●●    
204800|0.7494017094017094|그림을 보고 덧셈식을 써 보세요.    3+=, 2+=
204927|0.9306302270011948|모으기를 이용하여 덧셈을 해 보세요.       2+= 
204928|0.7924212354254527|위 칸의 두 수를 더해서 아래 칸의 수를 만들려고 합니다. 빈칸에 알맞은 수를 써넣으세요.     
204929|0.9157241073408738|그림을 보고 덧셈식을 써 보세요.  +=   
204930|0.8357471801374892|연못에 오리 5마리가 있습니다. 잠시 후에 오리 2마리가 더 들어왔습니다. 연못에 있는 오리는 모두 몇 마리인지 덧셈식을 쓰고, 답을 구하세요.   (식) +=, (답) 마리   
204931|0.8457275990176941|합이 같은 것끼리 이어 보세요.       
204937|0.9448433420365535|모으기를 이용하여 덧셈을 해 보세요.   +=       
204938|0.9444535206665577|그림을 보고 덧셈식을 써 보세요.  +=   
204939|0.8776540460282108|재성이의 필통에는 연필 2자루가 들어 있습니다. 연필 6자루를 더 넣으면 재성이 필통의 연필은 모두 몇 자루인지 덧셈식을 쓰고, 답을 구하세요.   (식) +=, (답) 자루   
204940|0.7640232108317214|합이 같은 것을 찾아 기호를 쓰세요.   ,    
204941|0.8812072554267023|세 수로 덧셈식을 만들어 보세요.   +=
204947|0.9601655861907366|다음을 뺄셈식으로 나타내려고 합니다. 曹曹曹曹曹曹曹曹 안에 - 또는 =를 알맞게 써넣으세요.  835   
204948|0.7820632512545221|그림에 알맞은 뺄셈식을 쓰고 읽어 보세요.    5-=  5와 의 차는 입니다. 
204949|0.9161237785016286|그림에 알맞은 뺄셈식을 쓰고 읽어 보세요.6-3= 6 빼기 은 과 같습니다.   
204950|0.6800019756013237|그림을 보고 나비는 꿀벌보다 몇 마리 더 많은지 뺄셈식으로 나타내어 보세요.        -=
204951|0.7128702207862143|그림을 보고 바르게 설명한 것을 찾아 기호를 쓰세요.     ,   
204957|0.9279027754967974|다음을 뺄셈식으로 나타내어 보세요.   -=   
204958|0.6267527489155654|그림에 알맞은 뺄셈식을 쓰고 읽어 보세요.  (1) 4-= (2) 4  3은 과 같습니다.  (3) 4와 3의 는 입니다. 
204959|0.9108034132989856|다음을 읽고 남은 사과는 몇 개인지 뺄셈식으로 나타내어 보세요.       7-=
204960|0.7559960841899168|그림을 보고 잘못 설명한 것은 어느 것인가요?  
204961|0.6701720841300192|숟가락은 포크보다 몇 개 더 많은지 뺄셈식을 이용하여 구해보세요. -=&#10140; 숟가락은 포크보다 개 더 많습니다.
204967|0.8836770360013981|그림을 보고 뺄셈식을 써 보세요.  5-=   
204968|0.8304796758593648|그림을 보고 뺄셈식을 써 보세요.   -5=   
204969|0.6904423005957088|8-4=曹曹曹曹曹曹曹曹에 알맞은 그림을 찾아 기호를 쓰고, 뺄셈을 해 보세요.   , 8-4=
204970|0.8239236916731116|알맞은 것끼리 이어 보세요.       8-3=5 7-6=1 5-3=2
204971|0.7488981674785432|은 보다 몇 개 더 많은지 뺄셈식을 써 보세요.  -=
204977|0.9085095917363503|그림을 보고 뺄셈식을 써 보세요.  8-=   
204978|0.881259842519685|그림을 보고 뺄셈식을 써 보세요.  -4=   
204979|0.8938690571474308|알맞은 것끼리 이어 보세요. 6-2=47-4=35-3=2      
204980|0.7564999340108223|다음을 읽고 민우에게 남은 색종이는 몇 장인지 그림으로 바르게 나타낸 것을 찾아 기호를 쓰고, 뺄셈식으로 나타내어 보세요. 민우는 색종이 7장 중에서 3장을 동생에게 주었습니다.   , 7-=
204981|0.8332846288720047|그림을 보고 도미노의 왼쪽 칸의 점이 오른쪽 칸의 점보다 몇 개 더 많은지 뺄셈식을 써 보세요.   7 -  = 
204987|0.9189688341669873|가르기를 이용하여 뺄셈을 해 보세요.  5-=   
204988|0.7430428832116789|파란 바구니에는 달걀을 몇 개 담을 수 있는지 뺄셈식을 쓰고, 답을 구해 보세요.  (식) -=, (답) 개
204989|0.6835340960637065|100원짜리 동전이 10원짜리 동전보다 몇 개 더 많은지 뺄셈식을 써 보세요.   -  = 
204990|0.6972574399236114|차가 같은 것을 찾아 기호를 써 보세요.  , 
204991|0.768084701705446|놀이터에 어린이 9명이 있습니다. 잠시 후에 3명이 집으로 돌아갔다면 놀이터에 남은 어린이는 몇 명인지 뺄셈식을 쓰고, 답을 구해 보세요. (식) -=, (답) 명   
204997|0.9092935528120714|가르기를 이용하여 뺄셈을 해 보세요.  9-=   
204998|0.7940801586177595|그림을 보고 뺄셈식을 써 보세요.  -=
204999|0.6949298547871031|그림을 보고 귤이 딸기보다 몇 개 더 많은지 뺄셈식을 쓰고, 답을 구해 보세요.  (식) -=, (답) 개  
205000|0.8940147487566455|세 수로 뺄셈식을 만들어 보세요.  -=
205001|0.8320610687022901|자전거 대여점에 자전거 8대가 있습니다. 자전거 5대를 대여해 주었다면 남은 자전거는 몇 대인지 뺄셈식을 쓰고, 답을 구해 보세요.  (식) -=, (답) 대
205007|0.878203048978268|덧셈식을 쓰고 읽어 보세요.   4+0= 4 더하기 은 와 같습니다.     
205008|0.8822283759569962|[보기]와 같이 덧셈을 해 보세요.   &#10140; +5=   
205009|0.9523384505533738|같은 것끼리 선으로 이어 보세요.     
205010|0.8168861235711186|차가 다른 하나를 찾아 기호를 쓰세요.     
205011|0.7709219858156028|감나무에 감이 7개 달려 있었는데 감 7개를 모두 땄습니다. 남은 감은 몇 개인지 뺄셈식을 쓰고, 답을 구해 보세요.  (식) -=, (답) 개
205017|0.8930379746835443|曹曹曹曹曹曹曹曹 안에 알맞은 수를 써넣으세요. (1) 3+0= (2) 0+6=  (3) 7-0= (4) 9-9=       
205018|0.8968561584840654|덧셈식을 쓰고 읽어 보세요.+5=과 5의 합은 입니다.
205019|0.8616848926690968|뺄셈식을 쓰고 읽어 보세요.5-0=와 의 차는 입니다.    
205020|0.8884884460462158|계산 결과가 같은 것끼리 선으로 이어 보세요.    
205021|0.7566724436741767|풍선이 5개 있었는데 모두 날아갔습니다. 남아 있는 풍선은 몇 개인지 뺄셈식을 쓰고, 답을 구해 보세요.  (식) -=, (답) 개   
205027|0.8262610088070457|덧셈과 뺄셈을 해 보세요.          (1)6+1= 6+2= 6+3=(2)6-1= 6-2= 6-3=
205028|0.8407115697990223|계산이 틀린 것은 어느 것인가요?
205029|0.7451012588943623|계산 결과가 다른 하나를 찾아 기호를 써 보세요.     
205030|0.6137348744807658|강민이와 시은이가 가위바위보를 했습니다. 두 사람이 펼친 손가락 수의 합과 차를 각각 구해 보세요.   강민 시은 합: , 차: 
205031|0.6130153999006458|수 카드 중에서 가장 큰 수와 가장 작은 수의 차를 구해 보세요.             
205037|0.9421619465496609|계산 결과가 5인 것은 어느 것인가요?
205038|0.8283410138248848|옥수수 수의 합을 구하는 덧셈식과 차를 구하는 뺄셈식을 각각 써 보세요.      합: 4+=, 차: 4-=
205039|0.9538366844480919|曹曹曹曹曹曹曹曹안에 + 또는 &#8211;를 알맞게 써넣으세요. (1) 53=8 (2) 72=5
205040|0.6763831732967536|계산 결과가 가장 큰 것과 가장 작은 것을 찾아 차례로 기호를 쓰세요.  ,    
205041|0.6054256726951919|㉠과 ㉡의 합을 구해 보세요.             
206554|0.891283459162663|긴 것부터 차례로 기호를 써 보세요.   , , 
206555|0.8822205551387847|볼펜보다 더 짧은 것을 모두 찾아 기호를 써 보세요.    ,    
206556|0.7652160365600332|길이가 가장 긴 것을 찾아 기호를 써 보세요.    
206557|0.9447733233420756|깃발보다 높은 것을 찾아 기호를 써 보세요.      
206558|0.8311213694941335|키가 큰 사람부터 차례로 이름을 써 보세요.   , , 
206559|0.935871743486974|가장 긴 것과 가장 짧은 것을 찾아 기호를 써 보세요.   가장 긴 것: , 가장 짧은 것: 
206560|0.8825643237027454|빗보다 더 긴 것은 몇 개인가요?  개
206561|0.8215077605321508|민정이네 집에서 학교까지 가는 길은 3가지입니다. 가장 짧은 길을 찾아 기호를 써 보세요.      
206562|0.9607304460245637|가장 높은 것을 찾아 기호를 써 보세요.   
206563|0.7158051478408849|연서네 반은 키가 작은 학생부터 순서대로 번호를 정했습니다. 연서가 7번, 민재가 9번이라면 키가 더 큰 학생은 누구인가요?     
206564|0.9513665262984065|어느 것이 더 무거울까요?    닭소 
206565|0.8432320441988951|가벼운 것부터 차례로 1, 2, 3을 써 보세요.         
206566|0.9313311558989883|필통보다 더 무거운 것을 찾아 기호를 써 보세요.      
206567|0.9226320725226633|가장 무거운 것은 어느 것인가요? 
206568|0.8503420752565565|가장 무거운 것과 가장 가벼운 것을 써 보세요.     가장 무거운 것: , 가장 가벼운 것:    
206569|0.9751381215469613|관계있는 것끼리 선으로 이어 보세요.    
206570|0.8056277056277056|무게를 비교한 것입니다. 바르게 말한 어린이는 누구인가요?   
206571|0.881791483113069|똑같은 접시에 무게가 같은 컵케이크를 각각 놓았습니다. 가벼운 것부터 차례로 기호를 써 보세요.   , , 
206572|0.886132429055863|모양과 크기가 같은 통이 2개 있습니다. ㉠ 통 속에는 돌을 가득 넣고, ㉡ 통 속에는 솜을 가득 넣었습니다. ㉠과 ㉡ 중 더 무거운 통의 기호를 써 보세요.    
206573|0.6809411764705883|재석이와 민준이가 시소에 앉아 있는 모습입니다. 민준이가 시연이보다 더 무겁다고 할 때 가장 무거운 어린이부터 차례로 이름을 써 보세요.   , ,    
206574|0.9275421647289995|더 넓은 것은 어느 것인가요?    수첩공책 
206575|0.8343348239239798|넓은 것부터 차례로 1, 2, 3을 써 보세요.  
206576|0.6714567337621913|색종이로 가릴 수 있는 물건을 찾아 기호를 써 보세요.      
206577|0.7881173035419576|[보기]에서 알맞은 장소를 찾아 曹曹曹曹曹曹曹曹 안에 써넣으세요.   야구장보다 더 넓은 곳은 입니다. 
206578|0.7593479183079813|유리네 가족은 텃밭에 그림과 같이 상추, 깻잎, 오이를 심었습니다. 가장 좁은 부분에 심은 것은 무엇인가요?(단, 점선으로 나뉘어진 칸의 넓이는 모두 같습니다.)   깻잎       오이   상추       
206579|0.8482057186720399|우표와 시계의 넓이를 비교하여 曹曹曹曹曹曹曹曹 안에 알맞은 말을 써넣으세요.  는 보다 더 넓습니다. 
206580|0.9517179429598024|다음 물건들을 포장하려고 합니다. 가장 넓은 포장지가 필요한 것을 찾아 기호를 써 보세요.   
206581|0.7995735607675906|왼쪽 사진을 접지 않고 봉투에 넣으려고 합니다. ㉠과 ㉡ 중 어느 봉투에 넣어야 할까요?  
206582|0.8270412642669008|㉮와 ㉯ 중에서 더 좁은 것은 어느 것인지 써 보세요.      
206583|0.7478061293371135|다음을 읽고 가장 넓은 곳을 찾아 기호를 써 보세요.      
206584|0.9254835996635828|담을 수 있는 물의 양이 더 많은 것은 어느 것인가요? 냄비그릇 
206585|0.8921054690556295|각각의 컵에 물을 가득 담았을 때 많이 담을 수 있는 것부터 차례로 1, 2, 3을 써 보세요.  
206586|0.8137864700224431|진서와 희주가 컵에 물을 같은 높이로 담아 각자 모두 마셨습니다. 물을 더 많이 마신 사람은 누구인가요? 진서희주   
206587|0.9173116089613035|그림과 같이 모양과 크기가 같은 세 통에 각각 물을 담았습니다. 담긴 물의 양이 가장 많은 것은 어느 것인가요?      
206588|0.7500585754451734|병에 가득 들어 있는 우유를 컵에 가득 따랐더니 병에 우유가 남았습니다. 병과 컵 중 우유를 더 많이 담을 수 있는 것은 어느 것인가요?    
206589|0.898034398034398|컵과 병에 담을 수 있는 주스의 양을 비교하여 曹曹曹曹曹曹曹曹 안에 알맞은 말을 써넣으세요.컵병은 보다 담을 수 있는주스의 양이 더 많습니다.    
206590|0.9093519278096801|담을 수 있는 물의 양이 가장 많은 것은 어느 것인가요?  
206591|0.8835671342685371|담긴 물의 양이 많은 것부터 차례로 1, 2, 3을 써 보세요.  
206592|0.7506112469437652|주희의 컵에 담겨 있던 음료수를 윤재의 컵에 모두 부었더니 넘쳤습니다. 두 사람 중 크기가 더 작은 컵을 가진 사람은 누구인가요?    
206593|0.7274323335771763|똑같은 종이컵으로 주전자에는 8컵을, 물병에는 6컵을 부었더니 가득 찼습니다. 담을 수 있는 물의 양이 더 많은 것은 어느 것인가요?     
207757|0.8463878326996198|曹曹曹曹曹曹曹曹 안에 알맞은 수나 말을 써넣으세요.  9보다 1 큰 수를 이라 쓰고,‘십’ 또는 ‘’이라고 읽습니다. 
207758|0.8115038945476333|다섯부터 열까지 세려고 합니다. 曹曹曹曹曹曹曹曹 안에 알맞은 말을 써넣으세요.  -----
207759|0.9169333617808122|모으기 하여 10이 되는 두 수끼리 이어 보세요.           
207760|0.6480605487228004|밑줄 친 부분을 읽어 보세요.       
207761|0.6269486775267122|㉠과 ㉡의 합을 구해 보세요.       
207762|0.9095050106286061|그림을 보고 曹曹曹曹曹曹曹曹 안에 알맞은 수를 써넣으세요.  7보다 3 큰 수는 입니다.        
207763|0.9500567536889898|10개인 것을 찾아 기호를 써 보세요.   
207764|0.8817790530846485|수를 거꾸로 세어 보려고 합니다. 曹曹曹曹曹曹曹曹 안에 알맞은 말을 써넣으세요.  ----
