question_id|difficulty|question_text
235184|0.7282096584216725|쿠키 92개를 한 상자에 6개씩 담아서 팔려고 합니다. 팔 수 있는 쿠키는 몇 상자인지 구해 보세요. 상자
235185|0.5672964169381107|4장의 수 카드 중 3장을 골라 몫이 가장 큰 (몇십몇)÷(몇)의 나눗셈식을 만들었습니다. 만든 나눗셈식의 몫과 나머지를 구해 보세요.  몫: , 나머지: 
235196|0.867190332326284|曹曹曹曹曹曹曹曹 안에 알맞은 수를 써넣으세요. 6÷3=60÷3=600÷3=
235197|0.6608374779399968|계산해 보세요. (1)   2480(2)   5650
235198|0.56310890474713|빈칸에 알맞은 수를 써넣으세요. 
235199|0.650818447327311|관계있는 것끼리 이어 보세요.       
235200|0.5288223373114164|연필 136자루를 연필꽂이 8개에 똑같이 나누어 꽂으려고 합니다. 연필꽂이 한 개에 연필을 몇 자루씩 꽂아야 할까요? 자루
235216|0.6662864529865784|曹曹曹曹曹曹曹曹 안에 알맞은 수를 써넣으세요.    3203      23       
235217|0.5672617412798682|曹曹曹曹曹曹曹曹 안에는 나눗셈의 몫을 써넣고,  안에는 나머지를 써넣으세요. 
235218|0.7689584587597833|나머지가 가장 큰 나눗셈을 찾아 기호를 써 보세요.  
235219|0.6136071198799057|점토 110kg을 한 덩이에 7kg씩 나누려고 합니다. 몇 덩이가 되고, 몇 kg이 남을까요? 덩이가 되고, kg이 남습니다.
235220|0.4482943143812709|수 카드 4장 중에서 3장을 골라 가장 큰 세 자리 수를 만들었습니다. 이 수를 남은 카드의 수로 나누는 나눗셈식을 쓰고, 몫과 나머지를 구해 보세요.              나눗셈식: ÷, 몫: , 나머지: 
235226|0.6311657279399215|계산해 보세요. (1) 407÷2=(2) 323÷5=
235227|0.8183919432062077|나머지가 같은 것끼리 이어 보세요.      
235228|0.5900874140711194| 2년은 730일입니다. 730일은 몇 주 며칠인지 구해 보세요. 주 일
235229|0.5384615384615384|설명하는 수를 9로 나눈 몫과 나머지를 구해 보세요.  몫: , 나머지: 
235230|0.6335393534977848|주어진 나눗셈식의 나머지는 5입니다. 1부터 9까지의 수 중에서 曹曹曹曹曹曹曹曹 안에 들어갈 수 있는 수는 몇 개인지 구해 보세요.  개
235236|0.7622288047394123|민우가 계산한 것을 보고 계산 결과가 맞는지 확인해 보려고 합니다. 曹曹曹曹曹曹曹曹 안에 알맞은 수를 써넣으세요.  07322  21  01(확인) 3×=, 21+=
235237|0.6644648389548138|계산해 보고 계산 결과가 맞는지 확인해 보세요. (1) 34÷4=    (확인) 4×=32, 32+=34 (2) 40÷6=    (확인) 6×=36, 36+=40
235238|0.7566948303021624|관계있는 것끼리 이어 보세요.    
235239|0.5724133832531051|초콜릿 29개를 5개씩 묶으면 몇 묶음이 되고, 몇 개가 남는지 알아보려고 합니다. 물음에 답하세요.  (1) 식을 쓰고 답을 구해 보세요.(식) ÷=(답) 묶음이 되고, 개가 남습니다. (2) 계산 결과가 맞는지 확인해 보세요.(확인) 5×=25, 25+=29
235240|0.5541691548543232|曹曹曹曹曹曹曹曹 안에 알맞은 수를 써넣으세요. ÷8=116
235246|0.821619001454193|계산을 하고 계산 결과가 맞는지 확인해 보려고 합니다. 曹曹曹曹曹曹曹曹 안에 알맞은 수를 써넣으세요.  (확인) 4×=, 24+=26
235247|0.7165354330708661|계산해 보고 계산 결과가 맞는지 확인해 보세요. 683(확인) 6×=78, 78+=
235248|0.7060240963855422|계산을 하고 계산 결과가 맞는지 확인한 식입니다. 계산한 나눗셈식을 쓰고 몫과 나머지를 구해 보세요.  (식) ÷8  (몫)   (나머지) 
235249|0.6189600401270691|87을 어떤 수로 나누었더니 몫이 12이고, 나머지가 3이었습니다. 어떤 수는 얼마인지 구해 보세요. 
235250|0.5369135508454393|효선이가 계산을 하고 계산 결과가 맞는지 확인한 식입니다. 曹曹曹曹曹曹曹曹 안에 알맞은 수를 써넣으세요.   26     (확인) ●×★=♥, ♥+5=26
235091|0.7472953664013063|수 모형을 보고 曹曹曹曹曹曹曹曹 안에 알맞은 수를 써넣으세요.&#10140;   60÷=
235092|0.7633687227252003|曹曹曹曹曹曹曹曹 안에 알맞은 수를 써넣으세요. (1) 9÷9= &#10140; 90÷9= (2) 8÷4= &#10140; 80÷4=
235093|0.7929226736566186|몫이 다른 하나를 찾아 기호를 써 보세요.  
235094|0.7764144134140247|몫의 크기를 비교하여  안에 &gt;, =, &lt;를 알맞게 써넣으세요.   
235095|0.5877999136495405|떡 80개를 한 상자에 5개씩 담으려고 합니다. 필요한 상자는 몇 상자일까요? 상자
235101|0.8133574007220217|계산해 보세요. (1) 60÷3=(2) 50÷2=
235102|0.8647925033467202|40÷4의 몫은 4÷4의 몫의 몇 배일까요? 배
235103|0.8078558412634137|몫이 30보다 큰 것을 찾아 기호를 써 보세요.  
235104|0.735141916261565|공책 60권을 5명에게 똑같이 나누어 주려고 합니다. 한 명에게 공책을 몇 권씩 나누어 줄 수 있을까요? 권
235105|0.5511643379906853|그림과 같은 직사각형 모양의 도화지를 잘라서 가로 5cm, 세로 4cm인 직사각형 모양의 카드를 만들려고 합니다. 카드를 최대 몇 장까지 만들 수 있는지 구해 보세요.   장
237040|0.9304547867634048|원의 중심을 찾아 써 보세요.  점 
237041|0.5892288293071409|반지름을 나타내는 선분을 모두 찾아 기호를 써 보세요.  , , 
237042|0.7966101694915254|원의 지름은 몇 cm일까요?  cm
237043|0.6900550884314294|원에 대한 설명으로 잘못된 것을 찾아 기호를 써 보세요.  
237044|0.8209923342599612|선분 ㄱㄴ의 길이는 몇 cm일까요?  cm
237050|0.8233164373642288|지름을 나타내는 선분을 모두 찾아 기호를 써 보세요.  , 
237051|0.8288606403013182|한 칸이 1cm인 모눈종이에 원을 그렸습니다. 그림을 보고 물음에 답하세요.  (1) 원의 반지름은 몇 cm일까요?cm (2) 曹曹曹曹曹曹曹曹 안에 알맞은 말을 써넣으세요.한 원에서 원의 반지름은 모두 .
237052|0.8680744777475022|曹曹曹曹曹曹曹曹 안에 알맞은 수를 써넣으세요. 
237053|0.7156154710319371|크기가 같은 원 3개를 맞닿게 그린 것입니다. 점 ㄱ, 점 ㄴ, 점 ㄷ이 원의 중심일 때, 선분 ㄱㄷ의 길이를 구해 보세요.  cm
237054|0.6971911024516967|반지름이 8cm인 두 원을 겹쳐서 그린 것입니다. 점 ㄱ, 점 ㄷ이 원의 중심일 때, 삼각형 ㄱㄴㄷ의 세 변의 길이의 합은 몇 cm일까요?  cm
237060|0.8827369742623979|원의 지름은 몇 cm일까요?  cm
237061|0.8087707857841538|曹曹曹曹曹曹曹曹 안에 알맞은 수를 써넣으세요. 
237062|0.8100659714832943|은호와 도원이가 그린 두 원의 크기는 같습니다. 曹曹曹曹曹曹曹曹 안에 알맞은 수를 써넣으세요. 
237063|0.635717889997283|두 원의 지름의 합을 구해 보세요.  cm
237064|0.630920105766978|작은 원의 반지름이 9cm일 때, 큰 원의 지름은 몇 cm인지 구해 보세요.  cm
237070|0.9091575091575091|원의 반지름은 몇 cm일까요?  cm
237071|0.7959858323494687|지름에 대하여 잘못 설명한 사람은 누구인지 찾아 이름을 써 보세요.  
237072|0.8488228004956629|크기가 가장 큰 원을 찾아 기호를 써 보세요.  
237073|0.7289677125966348|원의 중심이 같고 크기가 다른 두 원을 그린 것입니다. 큰 원의 지름은 몇 cm인지 구해 보세요.  cm
237074|0.7069306930693069|크기가 같은 원 4개를 겹쳐서 그린 것입니다. 선분 ㄱㄴ의 길이는 몇 cm일까요?  cm
237080|0.7524598653547385|컴퍼스를 이용하여 원 그리는 방법입니다. 曹曹曹曹曹曹曹曹 안에 순서대로 번호를 써넣으세요. ... 컴퍼스를 원의 반지름만큼 벌립니다.... 컴퍼스의 침을 점 ㅇ에 꽂고 원을 그립니다.... 원의 중심이 되는 점 ㅇ을 정합니다.
237081|0.8622347586383743|컴퍼스를 이용하여 지름이 10cm인 원을 그리려고 합니다. 컴퍼스의 침과 연필심 사이를 몇 cm가 되도록 벌려야 할까요? cm
237082|0.7257208039963813|주어진 모양을 그리기 위하여 컴퍼스의 침을 꽂아야 할 곳은 모두 몇 군데일까요?  군데
237083|0.5516133124709266|., 
237084|0.5630481305862113|., 
237090|0.9132791327913279|그림과 같이 컴퍼스를 벌려서 원을 그렸습니다. 그린 원의 지름은 몇 cm일까요?  cm
237091|0.8233360723089564|컴퍼스를 이용하여 주어진 원과 크기가 같은 원을 그리려고 합니다. 컴퍼스의 침과 연필심 사이를 몇 cm가 되도록 벌려야 할까요?cm
237092|0.8914728682170543|주어진 모양을 그릴 때 컴퍼스의 침을 꽂아야 할 곳이 더 많은 모양은 어느 것인지 찾아 기호를 써 보세요.  
237093|0.8382559774964838|원의 반지름은 변하지 않고, 원의 중심을 옮겨 가며 그린 것을 찾아 기호를 써 보세요.  
237094|0.539472243512537|원을 그린 규칙을 찾아 曹曹曹曹曹曹曹曹 안에 알맞은 수를 써넣으세요.  원의 반지름이 모눈 칸씩 커지고, 원의 중심이오른쪽으로 모눈 칸, 칸 이동하는 규칙입니다.
238491|0.879006145509813|사과 10개를 똑같이 5부분으로 나누었습니다. 曹曹曹曹曹曹曹曹 안에 알맞은 수를 써넣으세요. &#10140;     부분 은 전체 를 똑같이 5부분으로 나눈 것 중의 입니다.
238492|0.8529827038475115|색칠한 부분을 분수로 나타내려고 합니다. 曹曹曹曹曹曹曹曹 안에 알맞은 수를 써넣으세요.  색칠한 부분은 4묶음 중에서 1묶음이므로 전체의 ①②입니다.
238493|0.6219837479064574|그림을 보고 曹曹曹曹曹曹曹曹 안에 알맞은 수를 써넣으세요.         20을 4씩 묶으면 ①묶음이 됩니다. 8은 20의 ②③입니다.
238494|0.7217470698939759|㉠, ㉡, ㉢에 알맞은 수 중에서 다른 하나를 찾아 기호를 써 보세요.  
238495|0.4843716655522201|초콜릿 63개를 9개씩 묶은 후 그중 18개를 먹었습니다. 남은 초콜릿은 전체의 얼마인지 분수로 나타내어 보세요. ①②
238501|0.8737387510226343|색칠한 부분을 분수로 나타내어 보세요.       ①②
238502|0.6769415532425941|그림을 보고 曹曹曹曹曹曹曹曹 안에 알맞은 수를 써넣으세요.  30을 6씩 묶으면 ①묶음이 됩니다. 12는 30의 ②③입니다.
238503|0.5776869158878505|曹曹曹曹曹曹曹曹 안에 알맞은 수를 써넣으세요. (1) 28을 7씩 묶으면 21은 28의 ①②입니다. (2) 28을 4씩 묶으면 20은 28의 ③④입니다.
238504|0.5421416557652775|승우네 반 학생 30명 중에서 여학생은 12명입니다. 30명을 3명씩 묶으면 여학생 수는 전체의 얼마인지 분수로 나타내어 보세요. ①②曹曹曹曹曹曹曹曹
238505|0.758521768477894|연필 18자루를 2자루씩 묶었습니다. 그중 8자루는 나현이가 가지고 10자루는 규민이가 가진다면 잘못 말한 친구는 누구인가요? . 8자루는 18자루의 49야.. 10자루는 18자루의 69이야.
238511|0.8260557311117495|그림을 보고 曹曹曹曹曹曹曹曹 안에 알맞은 수를 써넣으세요.        (1) 14를 똑같이 7묶음으로 나눈 것 중의 1묶음은 입니다. (2) 14의 17은 입니다.
238512|0.6916682339665224|그림을 보고 曹曹曹曹曹曹曹曹 안에 알맞은 수를 써넣으세요.  (1) 16의 18은 입니다. (2) 16의 38은 입니다.     
238513|0.542181532239946|曹曹曹曹曹曹曹曹 안에 알맞은 수를 써넣으세요.  (1) 20cm의 25는 cm입니다. (2) 20cm의 310은 cm입니다.
238514|0.7441923898713461|사탕 40개 중에서 지원이는 전체의 38을, 병규는 전체의 25를 먹었습니다. 사탕을 더 많이 먹은 사람의 이름을 써 보세요. 
238515|0.6833451527329079|길이가 가장 긴 것을 찾아 기호를 써 보세요.  
238521|0.7248157248157249|그림을 보고 曹曹曹曹曹曹曹曹 안에 알맞은 수를 써넣으세요. (1) 24의 13은 입니다. (2) 24의 34은 입니다. (3) 24의 58는 입니다.
238522|0.6811369509043927|曹曹曹曹曹曹曹曹 안에 알맞은 수를 써넣으세요. (1) 30의 36은 입니다. (2) 35의 27는 입니다.
238523|0.6164700158131614|두 길이의 합은 몇 cm인지 구해 보세요.  cm
238524|0.5954804560260586|민하는 선물을 포장하는 데 1m짜리 리본 끈의 35을 사용했습니다. 남은 리본 끈은 몇 cm인지 구해 보세요. cm
238525|0.540930025256277|준서는 초콜릿을 10개 먹었습니다. 준서가 먹은 초콜릿은 전체 초콜릿의 29입니다. 전체 초콜릿은 모두 몇 개였는지 구해 보세요. 개
238531|0.7224292762574096|그림을 보고 曹曹曹曹曹曹曹曹 안에 알맞은 수를 써넣으세요. 15           ①②           
238532|0.7695750981337374|曹曹曹曹曹曹曹曹 안에 진분수는 ‘진’, 가분수는 ‘가’, 자연수는 ‘자’를 써넣으세요. (1) 74 &#10140;  (2) 69 &#10140;  (3) 5 &#10140; 
238533|0.7350705257373146|진분수와 가분수 개수의 차는 몇 개인지 구해 보세요.  개
238534|0.7542042543713109|★7이 진분수일 때, 다음 중 ★이 될 수 있는 수를 모두 고르세요.
238535|0.8219148417832878|분모가 12인 가분수 중에서 분자가 가장 작은 분수를 구해 보세요. ①曹曹曹曹曹曹曹曹②曹曹曹曹曹曹曹曹
238541|0.9105862505272038|曹曹曹曹曹曹曹曹 안에 알맞은 수를 써넣으세요. 
238542|0.7755819060166886|진분수와 가분수로 분류해 보세요.  (1) 진분수를 모두 찾아 기호를 써 보세요.,  (2) 가분수를 모두 찾아 기호를 써 보세요., , 
238543|0.8002118644067797|지효는 주스를 14컵씩 9번 마셨습니다. 지효가 마신 주스는 모두 몇 컵인지 가분수로 나타내어 보세요. ①②컵 
238544|0.7910064239828694|분모가 20인 진분수는 모두 몇 개인지 구해 보세요. 개
238545|0.7066582347095491|수 카드 4장 중 2장을 골라 한 번씩만 사용하여 가분수를 만들려고 합니다. 만들 수 있는 가분수는 모두 몇 개인지 구해 보세요.              개
238551|0.7068775958954312|보기를 보고 오른쪽 그림을 대분수로 나타내어 보세요. ①②③
238552|0.6280566280566281|진분수, 가분수, 대분수로 분류해 보세요.  (1) 진분수를 모두 찾아 기호를 써 보세요.,  (2) 가분수를 모두 찾아 기호를 써 보세요.,  (3) 대분수를 모두 찾아 기호를 써 보세요., 
238553|0.4983556121366433|그림을 보고 대분수는 가분수로, 가분수는 대분수로 나타내어 보세요. (1)345=①曹曹曹曹曹曹曹曹②   (2)75=③④⑤
238554|0.7362923047835129|대분수는 가분수로, 가분수는 대분수로 나타낸 것입니다. 잘못 나타낸 것을 찾아 기호를 써 보세요.  
238555|0.6298030889638233|자연수 부분이 5이고 분모가 8인 대분수는 모두 몇 개인지 구해 보세요. 개
238561|0.73936360386128|다음을 보고 물음에 답하세요.  (1) 가분수는 모두 몇 개일까요?개 (2) 대분수는 모두 몇 개일까요?개
238562|0.7321561062472177|자연수를 가분수로 나타내어 보세요. (1) 4=①2(2) 6=②曹曹曹曹曹曹曹曹6
238563|0.5955891463263536|다음이 설명하는 수를 대분수로 나타내고 읽어 보세요.  쓰기: ①②③, 읽기: ④과 ⑤분의 ⑥
238564|0.5920516781350934|㉠과 ㉡에 알맞은 수의 합을 구해 보세요.  
238565|0.686470532228887|수 카드 4장 중 3장을 골라 한 번씩만 사용하여 대분수를 만들려고 합니다. 만들 수 있는 분수 중에서 분모가 8인 대분수는 모두 몇 개인지 구해 보세요.              개
238571|0.9615451539933878|그림을 보고 분수의 크기를 비교하여  안에 &gt;, &lt;를 알맞게 써넣으세요.                     
238572|0.8031998798167205|258와 438의 크기를 바르게 비교한 사람은 누구인지 써 보세요.  
238573|0.8983685477400375|분수의 크기를 비교하여  안에 &gt;, &lt;를 알맞게 써넣으세요. (1)    (2)   
238574|0.7169657422512234|배 상자의 무게는 698kg이고 사과 상자의 무게는 838kg입니다. 배 상자와 사과 상자 중에서 더 무거운 것은 어느 것인지 써 보세요.  상자
238575|0.6813329862015101|가장 큰 분수를 찾아 기호를 써 보세요.  
238581|0.89422704378148|나타내는 수가 더 큰 것을 찾아 기호를 써 보세요.  
238582|0.6775789874381424|색칠한 부분을 대분수로 나타내고, 분수의 크기를 비교하여  안에 &gt;, &lt;를 알맞게 써넣으세요.       
238583|0.8100598802395209|세 사람이 가지고 있는 가방의 무게입니다. 누구의 가방이 가장 가벼운지 찾아 이름을 써 보세요. 건우태기성현145kg225kg315kg 
238584|0.611311013767209|분모가 9인 분수 중에서 209보다 크고 319보다 작은 분수는 모두 몇 개인지 구해 보세요. 개
238585|0.6508627910872843|1부터 9까지의 자연수 중에서 曹曹曹曹曹曹曹曹 안에 들어갈 수 있는 수는 모두 몇 개인지 구해 보세요.  개
241778|0.9366865210677255|냄비에 물을 가득 채운 후 물병에 옮겨 담았습니다. 냄비의 물을 모두 부었더니 물병의 물이 넘쳤다면 들이가 더 많은 것은 어느 것일까요?  &#10140;
241779|0.886408927859705|㉮ 그릇과 ㉯ 그릇에 물을 가득 채운 후 모양과 크기가 같은 컵에 각각 옮겨 담았더니 다음과 같았습니다. 들이가 더 많은 그릇의 기호를 쓰세요. 그릇㉮㉯컵의 수89  그릇
241780|0.9343192112976285|물의 양이 얼마인지 눈금을 읽고 曹曹曹曹曹曹曹曹 안에 알맞은 수를 써넣으세요.                           (1)(2) L mL
241781|0.7854074074074074|3L의 물이 들어 있는 수조에 580mL의 물을 더 부었습니다. 수조의 물이 넘치지 않았다면 수조에 들어 있는 물은 모두 몇 mL인지 구해 보세요. mL
241782|0.7464329392580513|들이가 많은 것부터 순서대로 기호를 써 보세요.  , , 
241788|0.9346504559270516|㉮, ㉯, ㉰ 통에 물을 가득 채운 후 모양과 크기가 같은 수조에 각각 옮겨 담았더니 다음과 같았습니다. 들이가 가장 많은 통을 찾아 기호를 쓰세요.  
241789|0.878200989885948|주전자와 냄비에 물을 가득 채운 후 모양과 크기가 같은 그릇에 옮겨 담았더니 다음과 같았습니다. 주전자의 들이는 냄비의 들이의 몇 배인지 구해 보세요. &#10140;&#10140;  배
241790|0.9426136363636364|曹曹曹曹曹曹曹曹 안에 알맞은 수를 써넣으세요. (1) 4L 500mL = mL (2) 7300mL = L mL
241791|0.6705579138872043|수조의 담긴 물의 양이 얼마인지 쓰고, 읽어 보세요. (1)(2) 쓰기: L읽기:  쓰기: L mL읽기: 
241792|0.8807919123841618|간장이 1360mL, 식초가 1L 520mL, 식용유가 1480mL 있습니다. 양이 가장 많은 것은 어느 것인가요? 
241798|0.7127736697114687|200mL 우유갑을 기준으로 들이를 어림한 것입니다. 알맞게 어림한 것을 찾아 기호를 써 보세요.     
241799|0.8815046089800773|항아리에 물을 가득 채운 후 비커에 모두 옮겨 담았습니다. 항아리의 들이는 몇 mL인가요?&#10140; mL
241800|0.7600070224719101|물건들의 들이를 L와 mL로 나타내려고 합니다. L와 mL 중에서 사용하기에 알맞은 단위가 다른 하나를 찾아 기호를 써 보세요.  
241801|0.7329316216924286|간장 통의 들이를 더 적절히 어림한 친구는 누구인가요?  
241802|0.7054152076038019|단위를 잘못 사용한 문장을 찾아 기호를 써 보세요.  
241808|0.9325353645266594|曹曹曹曹曹曹曹曹 안에 L와 mL 중에서 알맞은 단위를 써넣으세요. (1) 욕조의 들이는 약 50입니다. (2) 영양제 통의 들이는 약 400입니다.
241809|0.6270793036750484|[보기]에서 물건을 선택하여 문장을 완성해 보세요.  (1) 의 들이는 약 150mL입니다. (2) 의 들이는 약 1L입니다. (3) 의 들이는 약 10L입니다.
241810|0.9017857142857143|연우와 민정이가 들이가 2L인 그릇을 다음과 같이 어림하였습니다. 어림을 더 잘한 친구는 누구인가요?  
241811|0.8802228412256268|준서는 냄비의 들이를 다음과 같이 어림하였습니다. 준서가 실제 들이에 가깝게 어림하였다면 냄비의 들이는 약 몇 mL인가요?  약 mL
241812|0.7593938456780578|비커에 물을 가득 채운 후 100mL인 눈금실린더에 모두 옮겨 담았습니다. 비커의 들이는 약 몇 mL인가요? &#10140; 약 mL
242334|0.8590841146894959|그림을 보고 曹曹曹曹曹曹曹曹 안에 알맞은 수를 써넣으세요.(1) 3L700mL (2) 3L700mL +1L200mL  -1L200mL  LmL   LmL
242335|0.8195947275231162|曹曹曹曹曹曹曹曹 안에 알맞은 수를 써넣으세요. (1) 1L 400mL + 3L 500mL = L mL (2) 6L 400mL - 3L 300mL = L mL
242336|0.8052542151352764|들이를 비교하여  안에 &gt;, =, &lt;를 알맞게 써넣으세요.   
242337|0.6335947381735391|가장 많은 들이와 가장 적은 들이의 차를 구해 보세요.  L mL
242338|0.7017094017094017|냉장고에 사과 주스가 1L 700mL, 포도 주스가 2L 500mL 있습니다. 냉장고에 있는 사과 주스와 포도 주스는 모두 몇 L 몇 mL인가요? L mL
242339|0.8830740216878831|曹曹曹曹曹曹曹曹 안에 알맞은 수를 써넣으세요. (1) 3L200mL (2) 6L800mL +2L600mL  -1L400mL  LmL   LmL
242340|0.8199152542372882|두 들이의 합과 차를 각각 구해 보세요.  합: L mL, 차: L mL
242341|0.667684256432621|들이가 많은 것부터 순서대로 기호를 써 보세요.  , , 
242342|0.718172740888667|양동이에 물이 3L 100mL 들어 있었습니다. 그중에서 화단에 물을 주는 데 1L 400mL를 사용했습니다. 양동이에 남아 있는 물은 몇 L 몇 mL인가요? L mL
242343|0.693832053505078|曹曹曹曹曹曹曹曹 안에 알맞은 수를 써넣으세요.  L700mL+04LmL 13L400mL
242344|0.9554367201426025|저울로 연필과 지우개의 무게를 비교하고 있습니다. 연필과 지우개 중에서 어느 것이 더 무거운지 써 보세요.  
242345|0.7324654622741764|저울과 500원짜리 동전으로 자두와 복숭아의 무게를 비교하고 있습니다. 자두와 복숭아 중에서 어느 것이 500원짜리 동전 몇 개만큼 더 무거운지 써 보세요.       , 개
242346|0.811137806761627|"|잘못 나타낸 것을 찾아 기호를 써 보세요.  "
242347|0.892820407323596|장난감 상자의 무게는 몇 kg 몇 g인지 써 보세요.  kg g
242348|0.6214300825047598|무게가 가벼운 것부터 순서대로 기호를 써 보세요.  , , 
242349|0.8464402047463937|저울로 호박, 당근, 오이의 무게를 비교하고 있습니다. 오이, 당근, 호박 중에서 가장 무거운 채소는 어느 것인지 써 보세요.  
242350|0.9032371569317382|曹曹曹曹曹曹曹曹 안에 알맞은 수를 써넣으세요. (1) 2kg 260g = g (2) 5030g = kg g (3) 2t 840kg = kg
242351|0.8339938353148393|서진이는 2kg의 밤이 담긴 봉지에 650g의 밤을 더 넣었습니다. 봉지에 담긴 밤의 무게는 모두 몇 g인지 구해 보세요. g
242352|0.7942157953281423|똑같은 사과를 살구와 귤을 사용하여 무게를 재었습니다. 귤과 살구 중에서 한 개의 무게가 더 무거운 과일은 무엇인지 써 보세요.(단, 같은 종류의 과일은 무게가 같습니다.)     
242353|0.9169960474308301|컴퓨터의 무게는 5kg 400g, 의자의 무게는 4800g, 다리미의 무게는 1kg 700g입니다. 가장 무거운 물건은 무엇인지 써 보세요. 
242354|0.9203714451538015|주어진 소금 1봉지보다 더 무거운 것은 어느 것일까요? 
242355|0.9378684807256236|왼쪽 물건의 무게로 알맞은 것을 오른쪽에서 찾아 이어 보세요.   
242356|0.8863983698420784|무게가 1t보다 가벼운 것을 찾아 기호를 써 보세요.     
242357|0.7699290015278152|물건들의 무게를 나타내기에 알맞은 단위를 잘못 짝지은 것을 모두 찾아 기호를 써 보세요.    , 
242358|0.760700210796444|단위를 잘못 사용한 문장을 찾아 기호를 써 보세요.  
242359|0.9344858962693358|曹曹曹曹曹曹曹曹 안에 kg과 g 중에서 알맞은 단위를 써넣으세요. (1) 종이 한 장의 무게는 약 4입니다. (2) 주전자의 무게는 약 2입니다.
242360|0.9422442244224423|무게가 1kg보다 가벼운 것은 어느 것인가요?
242361|0.8839662447257384|[보기]에서 물건을 선택하여 문장을 완성해 보세요.  (1) 의 무게는 약 150kg입니다. (2) 의 무게는 약 2g입니다. (3) 의 무게는 약 5t입니다.
242362|0.9159891598915989|무게가 800g인 장난감의 무게를 어림하였습니다. 가장 잘 어림한 친구는 누구인가요?  
242363|0.8126642771804062|민우의 몸무게는 약 20kg이고 기린의 무게는 약 2t입니다. 기린의 무게는 민우의 몸무게의 몇 배쯤 되나요? 약 배
242364|0.8900883218842002|曹曹曹曹曹曹曹曹 안에 알맞은 수를 써넣으세요. (1) 1kg300g (2) 6kg800g +4kg500g  -2kg400g  kgg   kgg
242365|0.8924347966952859|두 물건의 무게는 모두 몇 kg 몇 g인가요?   kg g
242366|0.8385059049711617|무게를 비교하여  안에 &gt;, =, &lt;를 알맞게 써넣으세요.   
242367|0.6209498446515757|포도 한 상자의 무게는 12kg 450g이고, 감 한 상자의 무게는 14kg 850g입니다. 포도 한 상자와 감 한 상자의 무게는 모두 몇 kg 몇 g인가요? kg g
242368|0.5641719420053094|曹曹曹曹曹曹曹曹 안에 알맞은 수를 써넣으세요. kg g + 6kg 700g = 14kg 300g
